{
  "$schema": "http://json-schema.org/draft-07/schema#",
  "title": "ue-cocos-anchors-codex — anchor contract for UE→Cocos ports (v1 and v1.1)",
  "description": "Documentation schema. The executable authority is scripts/ue-cocos-anchors-codex.py validate, which implements these rules plus semantic checks (unique ids, tolerance-type consistency, loop-seam coverage, bool-is-not-a-number, kind-registry validation with kindRegistrySha binding). v1 files imply the 'fx' family for every kind; v1.1 files use namespaced 'family.kind' kinds, may name the ported entity via 'subject' instead of 'fx', and MUST record the sha256 of the pack's kind-registry.json in 'kindRegistrySha'.",
  "type": "object",
  "additionalProperties": false,
  "required": ["contract", "sessionId", "anchors"],
  "properties": {
    "contract": { "enum": ["ue-cocos-anchors-codex/v1", "ue-cocos-anchors-codex/v1.1"] },
    "fx": { "type": "string", "minLength": 1, "description": "Ported entity name, e.g. NS_example_glow. In v1.1 'subject' is an accepted alias — exactly one of the two, never both." },
    "subject": { "type": "string", "minLength": 1, "description": "v1.1 only: alias of 'fx' for non-FX families (materials, meshes, animations)." },
    "sessionId": { "type": "string", "minLength": 1, "description": "Project session id, e.g. S103" },
    "kindRegistrySha": { "type": "string", "pattern": "^[0-9a-f]{64}$", "description": "v1.1 only (required there): lowercase sha256 of the kind-registry.json in use. validate AND compare fail on mismatch — same discipline as --approved-sha." },
    "loop": {
      "type": ["object", "null"],
      "required": ["periodSec"],
      "properties": {
        "periodSec": { "type": "number", "exclusiveMinimum": 0 },
        "mode": { "const": "resetting", "description": "v1.1 only (required there when 'loop' is present); script-derived from dump fields, never author-chosen. The contract vocabulary is resetting|accumulating, but 'accumulating' is rejected by schema AND validator until the animations family profile implements its seam-continuity semantics (PORT-V2 phase 4) — this const widens to the enum then." }
      }
    },
    "anchors": {
      "type": "array",
      "minItems": 1,
      "items": {
        "type": "object",
        "additionalProperties": false,
        "required": ["id", "source", "target", "at", "expected", "tolerance", "units"],
        "properties": {
          "id": {
            "type": "string",
            "pattern": "^[a-z0-9]+(\\.[A-Za-z0-9_-]+)+$",
            "description": "Canonical join key, derived deterministically from UE names: <emitter>.<module|material>.<param>[.<atTag>]"
          },
          "source": {
            "type": "object",
            "additionalProperties": false,
            "required": ["file", "path"],
            "properties": {
              "file": { "type": "string", "minLength": 1, "description": "UE dump file (harvest artifact)" },
              "path": { "type": "string", "minLength": 1, "description": "JSON path / node inside the dump" },
              "chain": { "type": ["string", "null"], "description": "Chain-trace reference, e.g. _chains_S103.txt#L214" }
            }
          },
          "target": {
            "type": "object",
            "additionalProperties": false,
            "required": ["kind", "node"],
            "properties": {
              "kind": { "type": "string", "minLength": 1, "description": "What the probe samples. v1: bare kind, implied family 'fx' (particle_count, material_uniform, pass_state, ...). v1.1: namespaced 'family.kind' (fx.particle_count, ...). Every kind must exist in the pack's kind-registry.json, which also owns space/field requirements and unit conventions — unknown family or kind is a FAIL." },
              "node": { "type": "string", "minLength": 1, "description": "Cocos scene address, e.g. ExampleFx/dust" },
              "space": { "type": "string", "enum": ["world", "local"], "description": "Required for kinds the registry marks requiresSpace; Local buffers must be transformed through the node's world matrix by the probe" },
              "field": { "type": "string", "description": "Sub-field selector, e.g. uniform name or blendSrc; required for kinds the registry marks requiresField" },
              "extra": { "type": "object", "description": "Probe-specific parameters" }
            }
          },
          "at": {
            "type": "object",
            "additionalProperties": false,
            "properties": {
              "cycleTime": { "type": "number", "minimum": 0, "description": "Seconds within the loop cycle" },
              "tick": { "type": "integer", "minimum": 0, "description": "Deterministic tick index (tick-0 standard)" }
            },
            "oneOf": [
              { "required": ["cycleTime"], "not": { "required": ["tick"] } },
              { "required": ["tick"], "not": { "required": ["cycleTime"] } }
            ]
          },
          "expected": {
            "description": "Number, array of numbers, string (enums like blend modes), or bool. Booleans are never accepted where numbers are expected.",
            "type": ["number", "array", "string", "boolean"],
            "items": { "type": "number" }
          },
          "tolerance": {
            "type": "object",
            "additionalProperties": false,
            "properties": {
              "abs": { "type": "number", "minimum": 0 },
              "rel": { "type": "number", "minimum": 0 },
              "exact": { "type": "boolean" }
            },
            "description": "Numeric expected: abs and/or rel (pass if within either). String/bool expected: {\"exact\": true}."
          },
          "units": { "type": "string", "minLength": 1, "description": "m, m/s, 0..1, count, enum, flag, ... — kinds with a registry 'unitsAllowed' list are held to it" },
          "dd": {
            "type": "object",
            "additionalProperties": false,
            "required": ["id", "approvedBy"],
            "properties": {
              "id": { "type": "string", "minLength": 1, "description": "Declared-divergence id, e.g. DD-7" },
              "approvedBy": { "const": "USER" }
            },
            "description": "USER-approved deliberate divergence — the only legitimate way to differ from the source. Reported as DD by compare, never PASS/FAIL."
          },
          "transcribed": { "type": "boolean", "description": "v1.1 only: true marks a hand-entered value no derive helper could extract — a MANDATORY reviewer-focus item at the Stage-2 gate. Rejected in v1 files (unknown key)." },
          "note": { "type": "string" }
        }
      }
    }
  },
  "allOf": [
    {
      "if": { "properties": { "contract": { "const": "ue-cocos-anchors-codex/v1" } } },
      "then": {
        "required": ["fx"],
        "not": { "anyOf": [ { "required": ["subject"] }, { "required": ["kindRegistrySha"] } ] },
        "properties": {
          "loop": { "type": ["object", "null"], "additionalProperties": false, "required": ["periodSec"], "properties": { "periodSec": {} } },
          "anchors": { "items": { "not": { "required": ["transcribed"] } } }
        }
      }
    },
    {
      "if": { "properties": { "contract": { "const": "ue-cocos-anchors-codex/v1.1" } } },
      "then": {
        "required": ["kindRegistrySha"],
        "oneOf": [
          { "required": ["fx"], "not": { "required": ["subject"] } },
          { "required": ["subject"], "not": { "required": ["fx"] } }
        ],
        "properties": { "loop": { "type": ["object", "null"], "additionalProperties": false, "required": ["periodSec", "mode"], "properties": { "periodSec": {}, "mode": {} } } }
      }
    }
  ]
}
